<!DOCTYPE dataset SYSTEM "test.dtd">
<dataset>
	<PRODUCT
		id="1"
		name="John"
		price="888"
		amount="2"
		description="Hello"
      />
	<PRODUCT
		id="2"
		name="John"
		price="888"
		amount="2"
		description="Hello"
      />
	<PRODUCT
		id="3"
		name="John"
		price="888"
		amount="2"
		description="Hello"
      />
	<PRODUCT
		id="4"
		name="John"
		price="888"
		amount="2"
		description="Hello"
      />
	<PRODUCT
		id="5"
		name="John"
		price="888"
		amount="2"
		description="Hello"
      />
	<PRODUCT
		id="6"
		name="John"
		price="888"
		amount="2"
		description="Hello"
      />
	<PRODUCT
		id="7"
		name="John"
		price="888"
		amount="2"
		description="Hello"
      />
	<PRODUCT
		id="8"
		name="John"
		price="888"
		amount="2"
		description="Hello"
      />
	<PRODUCT
		id="9"
		name="John"
		price="888"
		amount="2"
		description="Hello"
      />
	<PRODUCT
		id="10"
		name="John"
		price="888"
		amount="2"
		description="Hello"
      />
	<PRODUCT
		id="11"
		name="John"
		price="888"
		amount="2"
		description="Hello"
      />
	<PRODUCT
		id="12"
		name="John"
		price="888"
		amount="2"
		description="Hello"
      />
	<PRODUCT
		id="13"
		name="John"
		price="888"
		amount="2"
		description="Hello"
      />
	<PRODUCT
		id="14"
		name="John"
		price="888"
		amount="2"
		description="Hello"
      />
	<PRODUCT
		id="15"
		name="John"
		price="888"
		amount="2"
		description="Hello"
      />
	<PRODUCT
		id="16"
		name="John"
		price="888"
		amount="2"
		description="Hello"
      />
	<PRODUCT
		id="17"
		name="John"
		price="888"
		amount="2"
		description="Hello"
      />
	<PRODUCT
		id="18"
		name="John"
		price="888"
		amount="2"
		description="Hello"
      />
	<PRODUCT
		id="19"
		name="John"
		price="888"
		amount="2"
		description="Hello"
      />
	<PRODUCT
		id="20"
		name="John"
		price="888"
		amount="2"
		description="Hello"
      />
	<PRODUCT
		id="21"
		name="John"
		price="888"
		amount="2"
		description="Hello"
      />
	<PRODUCT
		id="22"
		name="John"
		price="888"
		amount="2"
		description="Hello"
      />
	<PRODUCT
		id="23"
		name="John"
		price="888"
		amount="2"
		description="Hello"
      />
	<PRODUCT
		id="24"
		name="John"
		price="888"
		amount="2"
		description="Hello"
      />
	<PRODUCT
		id="25"
		name="John"
		price="888"
		amount="2"
		description="Hello"
      />
	<PRODUCT
		id="26"
		name="John"
		price="888"
		amount="2"
		description="Hello"
      />
	<PRODUCT
		id="27"
		name="John"
		price="888"
		amount="2"
		description="Hello"
      />
	<PRODUCT
		id="28"
		name="John"
		price="888"
		amount="2"
		description="Hello"
      />
	<PRODUCT
		id="29"
		name="John"
		price="888"
		amount="2"
		description="Hello"
      />
	<PRODUCT
		id="30"
		name="John"
		price="888"
		amount="2"
		description="Hello"
      />
	<PRODUCT
		id="31"
		name="John"
		price="888"
		amount="2"
		description="Hello"
      />
	<PRODUCT
		id="32"
		name="John"
		price="888"
		amount="2"
		description="Hello"
      />
	<PRODUCT
		id="33"
		name="John"
		price="888"
		amount="2"
		description="Hello"
      />
	<PRODUCT
		id="34"
		name="John"
		price="888"
		amount="2"
		description="Hello"
      />
	<PRODUCT
		id="35"
		name="John"
		price="888"
		amount="2"
		description="Hello"
      />
	<PRODUCT
		id="36"
		name="John"
		price="888"
		amount="2"
		description="Hello"
      />
	<PRODUCT
		id="37"
		name="John"
		price="888"
		amount="2"
		description="Hello"
      />
	<PRODUCT
		id="38"
		name="John"
		price="888"
		amount="2"
		description="Hello"
      />
	<PRODUCT
		id="39"
		name="John"
		price="888"
		amount="2"
		description="Hello"
      />
	<PRODUCT
		id="40"
		name="John"
		price="888"
		amount="2"
		description="Hello"
      />
	<PRODUCT
		id="41"
		name="John"
		price="888"
		amount="2"
		description="Hello"
      />
	<PRODUCT
		id="42"
		name="John"
		price="888"
		amount="2"
		description="Hello"
      />
	<PRODUCT
		id="43"
		name="John"
		price="888"
		amount="2"
		description="Hello"
      />
	<PRODUCT
		id="44"
		name="John"
		price="888"
		amount="2"
		description="Hello"
      />
	<PRODUCT
		id="45"
		name="John"
		price="888"
		amount="2"
		description="Hello"
      />
	<PRODUCT
		id="46"
		name="John"
		price="888"
		amount="2"
		description="Hello"
      />
	<PRODUCT
		id="47"
		name="John"
		price="888"
		amount="2"
		description="Hello"
      />
	<PRODUCT
		id="48"
		name="John"
		price="888"
		amount="2"
		description="Hello"
      />
	<PRODUCT
		id="49"
		name="John"
		price="888"
		amount="2"
		description="Hello"
      />
	<PRODUCT
		id="50"
		name="John"
		price="888"
		amount="2"
		description="Hello"
      />
	<PRODUCT
		id="51"
		name="John"
		price="888"
		amount="2"
		description="Hello"
      />
	<PRODUCT
		id="52"
		name="John"
		price="888"
		amount="2"
		description="Hello"
      />
	<PRODUCT
		id="53"
		name="John"
		price="888"
		amount="2"
		description="Hello"
      />
	<PRODUCT
		id="54"
		name="John"
		price="888"
		amount="2"
		description="Hello"
      />
	<PRODUCT
		id="55"
		name="John"
		price="888"
		amount="2"
		description="Hello"
      />
	<PRODUCT
		id="56"
		name="John"
		price="888"
		amount="2"
		description="Hello"
      />
	<PRODUCT
		id="57"
		name="John"
		price="888"
		amount="2"
		description="Hello"
      />
	<PRODUCT
		id="58"
		name="John"
		price="888"
		amount="2"
		description="Hello"
      />
	<PRODUCT
		id="59"
		name="John"
		price="888"
		amount="2"
		description="Hello"
      />
	<PRODUCT
		id="60"
		name="John"
		price="888"
		amount="2"
		description="Hello"
      />
	<PRODUCT
		id="61"
		name="John"
		price="888"
		amount="2"
		description="Hello"
      />
	<PRODUCT
		id="62"
		name="John"
		price="888"
		amount="2"
		description="Hello"
      />
	<PRODUCT
		id="63"
		name="John"
		price="888"
		amount="2"
		description="Hello"
      />
	<PRODUCT
		id="64"
		name="John"
		price="888"
		amount="2"
		description="Hello"
      />
	<PRODUCT
		id="65"
		name="John"
		price="888"
		amount="2"
		description="Hello"
      />
	<PRODUCT
		id="66"
		name="John"
		price="888"
		amount="2"
		description="Hello"
      />
	<PRODUCT
		id="67"
		name="John"
		price="888"
		amount="2"
		description="Hello"
      />
	<PRODUCT
		id="68"
		name="John"
		price="888"
		amount="2"
		description="Hello"
      />
	<PRODUCT
		id="69"
		name="John"
		price="888"
		amount="2"
		description="Hello"
      />
	<PRODUCT
		id="70"
		name="John"
		price="888"
		amount="2"
		description="Hello"
      />
	<PRODUCT
		id="71"
		name="John"
		price="888"
		amount="2"
		description="Hello"
      />
	<PRODUCT
		id="72"
		name="John"
		price="888"
		amount="2"
		description="Hello"
      />
	<PRODUCT
		id="73"
		name="John"
		price="888"
		amount="2"
		description="Hello"
      />
	<PRODUCT
		id="74"
		name="John"
		price="888"
		amount="2"
		description="Hello"
      />
	<PRODUCT
		id="75"
		name="John"
		price="888"
		amount="2"
		description="Hello"
      />
	<PRODUCT
		id="76"
		name="John"
		price="888"
		amount="2"
		description="Hello"
      />
	<PRODUCT
		id="77"
		name="John"
		price="888"
		amount="2"
		description="Hello"
      />
	<PRODUCT
		id="78"
		name="John"
		price="888"
		amount="2"
		description="Hello"
      />
	<PRODUCT
		id="79"
		name="John"
		price="888"
		amount="2"
		description="Hello"
      />
	<PRODUCT
		id="80"
		name="John"
		price="888"
		amount="2"
		description="Hello"
      />
	<PRODUCT
		id="81"
		name="John"
		price="888"
		amount="2"
		description="Hello"
      />
	<PRODUCT
		id="82"
		name="John"
		price="888"
		amount="2"
		description="Hello"
      />
	<PRODUCT
		id="83"
		name="John"
		price="888"
		amount="2"
		description="Hello"
      />
	<PRODUCT
		id="84"
		name="John"
		price="888"
		amount="2"
		description="Hello"
      />
	<PRODUCT
		id="85"
		name="John"
		price="888"
		amount="2"
		description="Hello"
      />
	<PRODUCT
		id="86"
		name="John"
		price="888"
		amount="2"
		description="Hello"
      />
	<PRODUCT
		id="87"
		name="John"
		price="888"
		amount="2"
		description="Hello"
      />
	<PRODUCT
		id="88"
		name="John"
		price="888"
		amount="2"
		description="Hello"
      />
	<PRODUCT
		id="89"
		name="John"
		price="888"
		amount="2"
		description="Hello"
      />
	<PRODUCT
		id="90"
		name="John"
		price="888"
		amount="2"
		description="Hello"
      />
	<PRODUCT
		id="91"
		name="John"
		price="888"
		amount="2"
		description="Hello"
      />
	<PRODUCT
		id="92"
		name="John"
		price="888"
		amount="2"
		description="Hello"
      />
	<PRODUCT
		id="93"
		name="John"
		price="888"
		amount="2"
		description="Hello"
      />
	<PRODUCT
		id="94"
		name="John"
		price="888"
		amount="2"
		description="Hello"
      />
	<PRODUCT
		id="95"
		name="John"
		price="888"
		amount="2"
		description="Hello"
      />
	<PRODUCT
		id="96"
		name="John"
		price="888"
		amount="2"
		description="Hello"
      />
	<PRODUCT
		id="97"
		name="John"
		price="888"
		amount="2"
		description="Hello"
      />
	<PRODUCT
		id="98"
		name="John"
		price="888"
		amount="2"
		description="Hello"
      />
	<PRODUCT
		id="99"
		name="John"
		price="888"
		amount="2"
		description="Hello"
      />
	<PRODUCT
		id="100"
		name="John"
		price="888"
		amount="2"
		description="Hello"
      />
</dataset>
